[
  {
    "schemaVersion": 1,
    "sourceId": "source-fixture-train-alpha",
    "sourceGroupId": "fixture-train-alpha",
    "sourceType": "SYNTHETIC",
    "sourceName": "CueNote generated fixture-minuet",
    "sourceUri": "internal://ai-training/fixture-train-alpha",
    "license": "CC0-1.0",
    "licenseUrl": "https://creativecommons.org/publicdomain/zero/1.0/",
    "copyrightHolder": "CueNote generated fixture",
    "allowedForTraining": true,
    "allowedForRedistribution": true,
    "allowedForDerivativeDataset": true,
    "attributionRequired": false,
    "collectedAt": "2026-07-13T00:00:00.000Z",
    "notes": "Generated from code-owned geometric score fixtures; no third-party score material."
  },
  {
    "schemaVersion": 1,
    "sourceId": "source-fixture-train-beta",
    "sourceGroupId": "fixture-train-beta",
    "sourceType": "SYNTHETIC",
    "sourceName": "CueNote generated fixture-hymn",
    "sourceUri": "internal://ai-training/fixture-train-beta",
    "license": "CC0-1.0",
    "licenseUrl": "https://creativecommons.org/publicdomain/zero/1.0/",
    "copyrightHolder": "CueNote generated fixture",
    "allowedForTraining": true,
    "allowedForRedistribution": true,
    "allowedForDerivativeDataset": true,
    "attributionRequired": false,
    "collectedAt": "2026-07-13T00:00:00.000Z",
    "notes": "Generated from code-owned geometric score fixtures; no third-party score material."
  },
  {
    "schemaVersion": 1,
    "sourceId": "source-fixture-train-gamma",
    "sourceGroupId": "fixture-train-gamma",
    "sourceType": "SYNTHETIC",
    "sourceName": "CueNote generated fixture-repeat",
    "sourceUri": "internal://ai-training/fixture-train-gamma",
    "license": "CC0-1.0",
    "licenseUrl": "https://creativecommons.org/publicdomain/zero/1.0/",
    "copyrightHolder": "CueNote generated fixture",
    "allowedForTraining": true,
    "allowedForRedistribution": true,
    "allowedForDerivativeDataset": true,
    "attributionRequired": false,
    "collectedAt": "2026-07-13T00:00:00.000Z",
    "notes": "Generated from code-owned geometric score fixtures; no third-party score material."
  },
  {
    "schemaVersion": 1,
    "sourceId": "source-fixture-validation-delta",
    "sourceGroupId": "fixture-validation-delta",
    "sourceType": "SYNTHETIC",
    "sourceName": "CueNote generated fixture-coda",
    "sourceUri": "internal://ai-training/fixture-validation-delta",
    "license": "CC0-1.0",
    "licenseUrl": "https://creativecommons.org/publicdomain/zero/1.0/",
    "copyrightHolder": "CueNote generated fixture",
    "allowedForTraining": true,
    "allowedForRedistribution": true,
    "allowedForDerivativeDataset": true,
    "attributionRequired": false,
    "collectedAt": "2026-07-13T00:00:00.000Z",
    "notes": "Generated from code-owned geometric score fixtures; no third-party score material."
  },
  {
    "schemaVersion": 1,
    "sourceId": "source-fixture-test-epsilon",
    "sourceGroupId": "fixture-test-epsilon",
    "sourceType": "SYNTHETIC",
    "sourceName": "CueNote generated fixture-scale",
    "sourceUri": "internal://ai-training/fixture-test-epsilon",
    "license": "CC0-1.0",
    "licenseUrl": "https://creativecommons.org/publicdomain/zero/1.0/",
    "copyrightHolder": "CueNote generated fixture",
    "allowedForTraining": true,
    "allowedForRedistribution": true,
    "allowedForDerivativeDataset": true,
    "attributionRequired": false,
    "collectedAt": "2026-07-13T00:00:00.000Z",
    "notes": "Generated from code-owned geometric score fixtures; no third-party score material."
  },
  {
    "schemaVersion": 1,
    "sourceId": "source-fixture-test-zeta",
    "sourceGroupId": "fixture-test-zeta",
    "sourceType": "SYNTHETIC",
    "sourceName": "CueNote generated fixture-rests",
    "sourceUri": "internal://ai-training/fixture-test-zeta",
    "license": "CC0-1.0",
    "licenseUrl": "https://creativecommons.org/publicdomain/zero/1.0/",
    "copyrightHolder": "CueNote generated fixture",
    "allowedForTraining": true,
    "allowedForRedistribution": true,
    "allowedForDerivativeDataset": true,
    "attributionRequired": false,
    "collectedAt": "2026-07-13T00:00:00.000Z",
    "notes": "Generated from code-owned geometric score fixtures; no third-party score material."
  }
]
